question,answer
How can I improve energy efficiency in my building?,"Consider installing energy-efficient lighting,  upgrading insulation,  sealing air leaks, and optimizing HVAC systems"
What are the benefits of smart thermostats in buildings?,"Smart thermostats can help reduce energy costs, improve comfort and provide remote control and scheduling features."
What is the role of Building Management Systems (BMS) in commercial buildings?,"Building Management Systems (BMS) help monitor and control building systems such as HVAC,  lighting  and security to optimize energy usage and occupant comfort."
How do green roofs contribute to sustainable building design?,"Green roofs provide insulation,  reduce stormwater runoff,  improve air quality and create habitat for wildlife contributing to energy efficiency and environmental sustainability."
What are some common challenges in building automation integration?,"Common challenges include compatibility issues between different systems,  complexity of integration and ensuring cybersecurity and data privacy."
